{
  "claim_ledger_id": "rs-claim-ledger-4774aaceed3998f7113403e4d6570f1f",
  "claims": [
    {
      "claim_eligibility": "causal_candidate",
      "claim_id": "rs-claim-ae5f2d5e87f07217257955012ff089c0",
      "claim_type": "design",
      "evidence_refs": [
        "rs-evidence-9d715d193bc16b9d97a7b84d0b712dd8",
        "rs-evidence-601aabd616e668c89bc6e40f3d32a382"
      ],
      "limitation_refs": [],
      "prohibited_expansions": [
        "confirmed_causal",
        "fully_robust",
        "whole_path_significance"
      ],
      "report_text": "研究采用已批准的 Local Projection 动态响应设计。",
      "review_required": true,
      "status": "qualified"
    },
    {
      "claim_eligibility": "causal_candidate",
      "claim_id": "rs-claim-ad93fed8b13336c3e071dcdf42dba299",
      "claim_type": "data",
      "evidence_refs": [
        "rs-evidence-c7b330d88024becb68b93f6a669c5b42",
        "rs-evidence-e6e4d4b800487b9393700ce8998fbf22"
      ],
      "limitation_refs": [],
      "prohibited_expansions": [
        "confirmed_causal",
        "fully_robust",
        "whole_path_significance"
      ],
      "report_text": "分析使用固定版本、CC0-1.0 许可的 Data and code for Local Projections, Example 5 数据。",
      "review_required": true,
      "status": "qualified"
    },
    {
      "claim_eligibility": "causal_candidate",
      "claim_id": "rs-claim-fe93d23c9c114517b6ee5ce5b5822213",
      "claim_type": "causal_candidate",
      "evidence_refs": [
        "rs-evidence-a5560c8d401b65dc1414d1e227cf2697",
        "rs-evidence-bf7163bd7cbbf6e9a1b0dd7dca3aa6a0",
        "rs-evidence-4307d2b3b729497cd7ac349be83701f9",
        "rs-evidence-4a04aa6e261763ca98b690062ec83438"
      ],
      "limitation_refs": [],
      "prohibited_expansions": [
        "confirmed_causal",
        "fully_robust",
        "whole_path_significance"
      ],
      "report_text": "h=0 时，估计值为 0.039，95% pointwise interval 为 [-0.074, 0.153]。",
      "review_required": true,
      "status": "qualified"
    },
    {
      "claim_eligibility": "causal_candidate",
      "claim_id": "rs-claim-bca49fcc6fb13d1657c96050c29b3945",
      "claim_type": "causal_candidate",
      "evidence_refs": [
        "rs-evidence-4945acee98a8aa626261ff8b786f0f91",
        "rs-evidence-3f2070747e37e9a58cd8d06a4932350f",
        "rs-evidence-3b31536311ad0717b344fee9a00d5783",
        "rs-evidence-c024334386a5d7d77c2392177abfcf6c"
      ],
      "limitation_refs": [],
      "prohibited_expansions": [
        "confirmed_causal",
        "fully_robust",
        "whole_path_significance"
      ],
      "report_text": "h=4 时，估计值为 -0.074，95% pointwise interval 为 [-0.473, 0.326]。",
      "review_required": true,
      "status": "qualified"
    },
    {
      "claim_eligibility": "causal_candidate",
      "claim_id": "rs-claim-e9b83451a0f1af39a175aa1b76673e33",
      "claim_type": "causal_candidate",
      "evidence_refs": [
        "rs-evidence-b3ec185727f9fbb004723cc5c5a04dda",
        "rs-evidence-ec705e1fe748072346a76fbfd9e81f24",
        "rs-evidence-820069c8795a79e4ab0fe2af6eac208c",
        "rs-evidence-873303799a4d5cc03cf930d09b8fdfed"
      ],
      "limitation_refs": [],
      "prohibited_expansions": [
        "confirmed_causal",
        "fully_robust",
        "whole_path_significance"
      ],
      "report_text": "h=8 时，估计值为 -0.473，95% pointwise interval 为 [-1.380, 0.435]。",
      "review_required": true,
      "status": "qualified"
    },
    {
      "claim_eligibility": "causal_candidate",
      "claim_id": "rs-claim-4f04fe12b66580039df08d43f0b6d159",
      "claim_type": "causal_candidate",
      "evidence_refs": [
        "rs-evidence-a0f6a8182aee7ac037d9325ec7bdea7b",
        "rs-evidence-2208b01099902909862841f62ee6d60e",
        "rs-evidence-11d9abde276b8df58734fad9bb3d2a01",
        "rs-evidence-9f3c3f351919c03dc6b815390a07e7e7"
      ],
      "limitation_refs": [],
      "prohibited_expansions": [
        "confirmed_causal",
        "fully_robust",
        "whole_path_significance"
      ],
      "report_text": "h=12 时，估计值为 -1.271，95% pointwise interval 为 [-2.542, 0.000]。",
      "review_required": true,
      "status": "qualified"
    },
    {
      "claim_eligibility": "causal_candidate",
      "claim_id": "rs-claim-a1f471ea7f7e233584b83bcea230ef35",
      "claim_type": "causal_candidate",
      "evidence_refs": [
        "rs-evidence-d27bac94f12516dd04b31de27b1f8065",
        "rs-evidence-ce2395311f21af64770dd287da5552b6",
        "rs-evidence-79f2c8de49ed5db5cae33b345631d2bc",
        "rs-evidence-7c0e5d84f22725eec1029aacff7f5a22"
      ],
      "limitation_refs": [],
      "prohibited_expansions": [
        "confirmed_causal",
        "fully_robust",
        "whole_path_significance"
      ],
      "report_text": "h=17 时，估计值为 -2.019，95% pointwise interval 为 [-3.883, -0.155]。",
      "review_required": true,
      "status": "qualified"
    },
    {
      "claim_eligibility": "causal_candidate",
      "claim_id": "rs-claim-6a1e5ca8ca6fb023b227fde878566645",
      "claim_type": "robustness",
      "evidence_refs": [
        "rs-evidence-5fc0f3566de3aa6dcf7f1dcb6276104e",
        "rs-evidence-029ebc73e1c7e3f852a01e983249bcbf",
        "rs-evidence-813a18f9d2318f0c003c830f9ed05548",
        "rs-evidence-7a448c2e1015feab159fc1f45ef4bee0",
        "rs-evidence-f9f34615102081bfd9647dcb95047c6c",
        "rs-evidence-770cf01abb1d13d3075fcb361dae273c"
      ],
      "limitation_refs": [],
      "prohibited_expansions": [
        "confirmed_causal",
        "fully_robust",
        "whole_path_significance"
      ],
      "report_text": "在已声明并实际执行的检查范围内，没有发现超过冻结阈值的敏感性；该审计为 post-result exploratory。",
      "review_required": true,
      "status": "qualified"
    }
  ],
  "effective_claim_eligibility": "causal_candidate",
  "schema_version": "0.1.0"
}
