{
  "claim_ledger_id": "rs-claim-ledger-aaaaaaaaaaaaaaaaaaaaaaaaaaaaaaaa",
  "claims": [
    {
      "claim_eligibility": "causal_candidate",
      "claim_id": "rs-claim-aaaaaaaaaaaaaaaaaaaaaaaaaaaaaaaa",
      "claim_type": "causal_candidate",
      "evidence_refs": [
        "rs-evidence-aaaaaaaaaaaaaaaaaaaaaaaaaaaaaaaa"
      ],
      "limitation_refs": [
        "rs-limitation-aaaaaaaaaaaaaaaaaaaaaaaaaaaaaaaa"
      ],
      "prohibited_expansions": [
        "confirmed_causal"
      ],
      "report_text": "在仍未解决的识别假设下，估计路径属于因果候选。",
      "review_required": true,
      "status": "qualified"
    }
  ],
  "effective_claim_eligibility": "causal_candidate",
  "schema_version": "0.1.0"
}
